{
  "$schema": "https://json-schema.org/draft/2020-12/schema",
  "$id": "https://boq-system.local/schemas/integration/parser-claim-envelope/1.0",
  "title": "Parser Claim Envelope 1.0",
  "type": "object",
  "additionalProperties": false,
  "required": [
    "contract_version",
    "claim_id",
    "case_id",
    "field_path",
    "value",
    "value_type",
    "unit",
    "field_state",
    "solver_readiness_state",
    "review_state",
    "source_document_hash",
    "page_number",
    "sheet_id",
    "source_locator",
    "evidence_ref",
    "conflict_ids",
    "review_provenance"
  ],
  "properties": {
    "contract_version": {
      "const": "parser.claim-envelope/1.0"
    },
    "claim_id": {
      "type": "string",
      "minLength": 1
    },
    "case_id": {
      "type": "string",
      "minLength": 1
    },
    "field_path": {
      "type": "string",
      "minLength": 1
    },
    "value": {},
    "value_type": {
      "type": "string",
      "minLength": 1
    },
    "unit": {
      "type": [
        "string",
        "null"
      ]
    },
    "field_state": {
      "enum": [
        "OBSERVED",
        "DERIVED_FROM_OBSERVATIONS",
        "REVIEW_REQUIRED",
        "CONFLICTING",
        "MISSING",
        "NOT_APPLICABLE",
        "MANUALLY_CONFIRMED",
        "MANUALLY_OVERRIDDEN"
      ]
    },
    "solver_readiness_state": {
      "enum": [
        "READY",
        "BLOCKED",
        "REVIEW_REQUIRED",
        "NOT_APPLICABLE"
      ]
    },
    "review_state": {
      "type": "string",
      "minLength": 1
    },
    "source_document_hash": {
      "type": "string",
      "pattern": "^[0-9a-f]{64}$"
    },
    "page_number": {
      "type": "integer",
      "minimum": 1
    },
    "sheet_id": {
      "type": "string",
      "minLength": 1
    },
    "source_locator": {
      "type": "object",
      "required": [
        "bounding_box",
        "coordinate_space"
      ],
      "additionalProperties": true,
      "properties": {
        "bounding_box": {
          "type": "object"
        },
        "coordinate_space": {
          "type": "string"
        }
      }
    },
    "evidence_ref": {
      "type": "object",
      "additionalProperties": false,
      "required": [
        "crop_path",
        "crop_hash"
      ],
      "properties": {
        "crop_path": {
          "type": "string",
          "minLength": 1
        },
        "crop_hash": {
          "type": "string",
          "pattern": "^[0-9a-f]{64}$"
        }
      }
    },
    "conflict_ids": {
      "type": "array",
      "items": {
        "type": "string"
      },
      "uniqueItems": true
    },
    "review_provenance": {
      "type": "object",
      "additionalProperties": false,
      "required": [
        "reviewer",
        "review_timestamp"
      ],
      "properties": {
        "reviewer": {
          "type": [
            "string",
            "null"
          ]
        },
        "review_timestamp": {
          "type": [
            "string",
            "null"
          ]
        }
      }
    }
  },
  "allOf": [
    {
      "if": {
        "properties": {
          "review_state": {
            "const": "MANUALLY_CONFIRMED"
          }
        },
        "required": [
          "review_state"
        ]
      },
      "then": {
        "properties": {
          "review_provenance": {
            "type": "object",
            "additionalProperties": false,
            "required": [
              "reviewer",
              "review_timestamp"
            ],
            "properties": {
              "reviewer": {
                "type": "string",
                "minLength": 1,
                "pattern": ".*\\S.*"
              },
              "review_timestamp": {
                "type": "string",
                "pattern": "^\\d{4}-\\d{2}-\\d{2}T\\d{2}:\\d{2}:\\d{2}(?:\\.\\d+)?(?:Z|[+-]\\d{2}:\\d{2})$"
              }
            }
          }
        }
      }
    }
  ]
}
