[
  {
    "contract_version": "parser.claim-envelope/1.0",
    "claim_id": "claim-001-b1-depth",
    "case_id": "PARSER-GOLDEN-001",
    "field_path": "beam_schedule.B1.depth",
    "value": 350,
    "value_type": "integer",
    "unit": "mm",
    "field_state": "OBSERVED",
    "solver_readiness_state": "READY",
    "review_state": "MANUALLY_CONFIRMED",
    "source_document_hash": "2ef1eca18e00f48e82417ca306941c87fb2a8ae03c764561b52d26aa351e4599",
    "page_number": 34,
    "sheet_id": "S7",
    "source_locator": {
      "bounding_box": {
        "x0": 366,
        "y0": 1613,
        "x1": 483,
        "y1": 1706,
        "coordinate_space_identifier": "IMAGE_PIXELS_TOP_LEFT",
        "origin_definition": "top-left",
        "page_width": 1653,
        "page_height": 2339,
        "units_or_normalization_rule": "integer pixels at declared render DPI",
        "render_dpi": 200
      },
      "coordinate_space": "IMAGE_PIXELS_TOP_LEFT"
    },
    "evidence_ref": {
      "crop_path": "evidence_crops/claim-001-b1-depth.png",
      "crop_hash": "b23a3f54ad23c05afc8e140af2e90923e716f63da2bed586b5774729a396ab19"
    },
    "conflict_ids": [],
    "review_provenance": {
      "reviewer": "PRODUCT_OWNER",
      "review_timestamp": "2026-08-15T03:53:40Z"
    }
  },
  {
    "contract_version": "parser.claim-envelope/1.0",
    "claim_id": "claim-001-b1-spacing",
    "case_id": "PARSER-GOLDEN-001",
    "field_path": "beam_schedule.B1.stirrup_spacing_raw",
    "value": "3 @ 0.075, 4 @ 0.10, REST @ 0.20 MTS.",
    "value_type": "string",
    "unit": "m",
    "field_state": "OBSERVED",
    "solver_readiness_state": "READY",
    "review_state": "MANUALLY_CONFIRMED",
    "source_document_hash": "2ef1eca18e00f48e82417ca306941c87fb2a8ae03c764561b52d26aa351e4599",
    "page_number": 34,
    "sheet_id": "S7",
    "source_locator": {
      "bounding_box": {
        "x0": 366,
        "y0": 204,
        "x1": 483,
        "y1": 710,
        "coordinate_space_identifier": "IMAGE_PIXELS_TOP_LEFT",
        "origin_definition": "top-left",
        "page_width": 1653,
        "page_height": 2339,
        "units_or_normalization_rule": "integer pixels at declared render DPI",
        "render_dpi": 200
      },
      "coordinate_space": "IMAGE_PIXELS_TOP_LEFT"
    },
    "evidence_ref": {
      "crop_path": "evidence_crops/claim-001-b1-spacing.png",
      "crop_hash": "02dc1d7374caf6fa3deb6b599528373ce4dd6efc17ff84a464774a632b1dd025"
    },
    "conflict_ids": [],
    "review_provenance": {
      "reviewer": "PRODUCT_OWNER",
      "review_timestamp": "2026-08-15T03:53:40Z"
    }
  },
  {
    "contract_version": "parser.claim-envelope/1.0",
    "claim_id": "claim-001-b1-stirrups",
    "case_id": "PARSER-GOLDEN-001",
    "field_path": "beam_schedule.B1.stirrups",
    "value": "D9",
    "value_type": "string",
    "unit": null,
    "field_state": "OBSERVED",
    "solver_readiness_state": "READY",
    "review_state": "MANUALLY_CONFIRMED",
    "source_document_hash": "2ef1eca18e00f48e82417ca306941c87fb2a8ae03c764561b52d26aa351e4599",
    "page_number": 34,
    "sheet_id": "S7",
    "source_locator": {
      "bounding_box": {
        "x0": 366,
        "y0": 710,
        "x1": 483,
        "y1": 837,
        "coordinate_space_identifier": "IMAGE_PIXELS_TOP_LEFT",
        "origin_definition": "top-left",
        "page_width": 1653,
        "page_height": 2339,
        "units_or_normalization_rule": "integer pixels at declared render DPI",
        "render_dpi": 200
      },
      "coordinate_space": "IMAGE_PIXELS_TOP_LEFT"
    },
    "evidence_ref": {
      "crop_path": "evidence_crops/claim-001-b1-stirrups.png",
      "crop_hash": "9227edc1e96fb2a612f11a6543245e6dab14b3bfc8a425b2f116ed1e5bda9bec"
    },
    "conflict_ids": [],
    "review_provenance": {
      "reviewer": "PRODUCT_OWNER",
      "review_timestamp": "2026-08-15T03:53:40Z"
    }
  },
  {
    "contract_version": "parser.claim-envelope/1.0",
    "claim_id": "claim-001-b1-width",
    "case_id": "PARSER-GOLDEN-001",
    "field_path": "beam_schedule.B1.width",
    "value": 200,
    "value_type": "integer",
    "unit": "mm",
    "field_state": "OBSERVED",
    "solver_readiness_state": "READY",
    "review_state": "MANUALLY_CONFIRMED",
    "source_document_hash": "2ef1eca18e00f48e82417ca306941c87fb2a8ae03c764561b52d26aa351e4599",
    "page_number": 34,
    "sheet_id": "S7",
    "source_locator": {
      "bounding_box": {
        "x0": 366,
        "y0": 1706,
        "x1": 483,
        "y1": 1799,
        "coordinate_space_identifier": "IMAGE_PIXELS_TOP_LEFT",
        "origin_definition": "top-left",
        "page_width": 1653,
        "page_height": 2339,
        "units_or_normalization_rule": "integer pixels at declared render DPI",
        "render_dpi": 200
      },
      "coordinate_space": "IMAGE_PIXELS_TOP_LEFT"
    },
    "evidence_ref": {
      "crop_path": "evidence_crops/claim-001-b1-width.png",
      "crop_hash": "c5fca0c2cb21c63c06b8a26697ecd2aaca1ac8ce9ee63c442617523822e72035"
    },
    "conflict_ids": [],
    "review_provenance": {
      "reviewer": "PRODUCT_OWNER",
      "review_timestamp": "2026-08-15T03:53:40Z"
    }
  },
  {
    "contract_version": "parser.claim-envelope/1.0",
    "claim_id": "claim-002-f3-bar-x",
    "case_id": "PARSER-GOLDEN-002",
    "field_path": "footing_schedule.F-3.reinforcement.bar_x_raw",
    "value": "10 - 20mmØ",
    "value_type": "string",
    "unit": null,
    "field_state": "OBSERVED",
    "solver_readiness_state": "READY",
    "review_state": "MANUALLY_CONFIRMED",
    "source_document_hash": "dbe6b79ea2c56e48956d1ed24dcad1ecd754a0a6149152e9dd544f9487b5046d",
    "page_number": 27,
    "sheet_id": "S-4",
    "source_locator": {
      "bounding_box": {
        "x0": 697,
        "y0": 942,
        "x1": 826,
        "y1": 993,
        "coordinate_space_identifier": "IMAGE_PIXELS_TOP_LEFT",
        "origin_definition": "top-left",
        "page_width": 3309,
        "page_height": 2339,
        "units_or_normalization_rule": "integer pixels at declared render DPI",
        "render_dpi": 200
      },
      "coordinate_space": "IMAGE_PIXELS_TOP_LEFT"
    },
    "evidence_ref": {
      "crop_path": "evidence_crops/claim-002-f3-bar-x.png",
      "crop_hash": "a448e92d5775449fec6dd2f3f41166898a052713be501203cae18d10dd8e885e"
    },
    "conflict_ids": [],
    "review_provenance": {
      "reviewer": "PRODUCT_OWNER",
      "review_timestamp": "2026-08-15T03:53:40Z"
    }
  },
  {
    "contract_version": "parser.claim-envelope/1.0",
    "claim_id": "claim-002-f3-bar-y",
    "case_id": "PARSER-GOLDEN-002",
    "field_path": "footing_schedule.F-3.reinforcement.bar_y_raw",
    "value": "10 - 20mmØ",
    "value_type": "string",
    "unit": null,
    "field_state": "OBSERVED",
    "solver_readiness_state": "READY",
    "review_state": "MANUALLY_CONFIRMED",
    "source_document_hash": "dbe6b79ea2c56e48956d1ed24dcad1ecd754a0a6149152e9dd544f9487b5046d",
    "page_number": 27,
    "sheet_id": "S-4",
    "source_locator": {
      "bounding_box": {
        "x0": 826,
        "y0": 942,
        "x1": 960,
        "y1": 993,
        "coordinate_space_identifier": "IMAGE_PIXELS_TOP_LEFT",
        "origin_definition": "top-left",
        "page_width": 3309,
        "page_height": 2339,
        "units_or_normalization_rule": "integer pixels at declared render DPI",
        "render_dpi": 200
      },
      "coordinate_space": "IMAGE_PIXELS_TOP_LEFT"
    },
    "evidence_ref": {
      "crop_path": "evidence_crops/claim-002-f3-bar-y.png",
      "crop_hash": "c6d1adf3e8a13f85e6e99b1d9891787885c3ee1e30af20b2ac87b6e25627b002"
    },
    "conflict_ids": [],
    "review_provenance": {
      "reviewer": "PRODUCT_OWNER",
      "review_timestamp": "2026-08-15T03:53:40Z"
    }
  },
  {
    "contract_version": "parser.claim-envelope/1.0",
    "claim_id": "claim-002-f3-depth",
    "case_id": "PARSER-GOLDEN-002",
    "field_path": "footing_schedule.F-3.depth",
    "value": 1500,
    "value_type": "integer",
    "unit": "mm",
    "field_state": "OBSERVED",
    "solver_readiness_state": "READY",
    "review_state": "MANUALLY_CONFIRMED",
    "source_document_hash": "dbe6b79ea2c56e48956d1ed24dcad1ecd754a0a6149152e9dd544f9487b5046d",
    "page_number": 27,
    "sheet_id": "S-4",
    "source_locator": {
      "bounding_box": {
        "x0": 513,
        "y0": 942,
        "x1": 605,
        "y1": 993,
        "coordinate_space_identifier": "IMAGE_PIXELS_TOP_LEFT",
        "origin_definition": "top-left",
        "page_width": 3309,
        "page_height": 2339,
        "units_or_normalization_rule": "integer pixels at declared render DPI",
        "render_dpi": 200
      },
      "coordinate_space": "IMAGE_PIXELS_TOP_LEFT"
    },
    "evidence_ref": {
      "crop_path": "evidence_crops/claim-002-f3-depth.png",
      "crop_hash": "15f3de6048509014941e2781fa070fa9972f57d4c6828ce4713f4b6c48086f57"
    },
    "conflict_ids": [],
    "review_provenance": {
      "reviewer": "PRODUCT_OWNER",
      "review_timestamp": "2026-08-15T03:53:40Z"
    }
  },
  {
    "contract_version": "parser.claim-envelope/1.0",
    "claim_id": "claim-002-f3-length",
    "case_id": "PARSER-GOLDEN-002",
    "field_path": "footing_schedule.F-3.length",
    "value": 2100,
    "value_type": "integer",
    "unit": "mm",
    "field_state": "OBSERVED",
    "solver_readiness_state": "READY",
    "review_state": "MANUALLY_CONFIRMED",
    "source_document_hash": "dbe6b79ea2c56e48956d1ed24dcad1ecd754a0a6149152e9dd544f9487b5046d",
    "page_number": 27,
    "sheet_id": "S-4",
    "source_locator": {
      "bounding_box": {
        "x0": 329,
        "y0": 942,
        "x1": 421,
        "y1": 993,
        "coordinate_space_identifier": "IMAGE_PIXELS_TOP_LEFT",
        "origin_definition": "top-left",
        "page_width": 3309,
        "page_height": 2339,
        "units_or_normalization_rule": "integer pixels at declared render DPI",
        "render_dpi": 200
      },
      "coordinate_space": "IMAGE_PIXELS_TOP_LEFT"
    },